{
  "$schema": "http://json-schema.org/draft-07/schema#",
  "title": "Event Detail Schema",
  "type": "object",
  "properties": {
    "id": { "type": "string" },
    "title": { "type": "string" },
    "category": { "type": "string" },
    "venueId": { "type": "string" },
    "start": { "type": "string", "format": "date-time" },
    "end": { "type": "string", "format": "date-time" },
    "description": { "type": "string" }
  },
  "required": ["id", "title", "start", "end", "description"]
}