
        {
        "id": "EVT-001",
        "title": "Keynote: AI trendy 2026",
        "category": "lecture",
        "venueId": "VEN-001",
        "start": "2026-08-21T10:00:00+02:00",
        "end": "2026-08-21T10:45:00+02:00",
        "description": "Co se reálně změnilo v AI za poslední rok a kam míří praxe."
        }
    